{
  "$schema": "/schemas/elsa-tree-7.json",
  "format": "elsa-tree/7",
  "languages": [
    "nl"
  ],
  "root": "start",
  "title": {
    "nl": "Is de AI-verordening van toepassing?"
  },
  "description": {
    "nl": "Een kleine Nederlandstalige boom voor de tests."
  },
  "metadata": {
    "version": "1.0"
  },
  "nodes": [
    {
      "id": "start",
      "title": {
        "nl": "Valt uw systeem binnen het bereik?"
      },
      "description": {
        "nl": "De eerste vraag. Lees de toelichting hieronder en antwoord dan."
      },
      "metadata": {
        "version": "1.0"
      },
      "sources": [
        {
          "id": "art-2",
          "kind": "legal",
          "label": {
            "nl": "Artikel 2 AI-verordening"
          },
          "url": "https://eur-lex.europa.eu/eli/reg/2024/1689/oj"
        }
      ],
      "images": [
        {
          "file": "kaart.png",
          "description": {
            "nl": "Kaart van de EU-lidstaten"
          },
          "credit": "Kaart: Voorbeeld Cartografie, CC BY 4.0",
          "source": "art-2"
        }
      ],
      "answers": [
        {
          "label": {
            "nl": "Ja"
          },
          "target": "van-toepassing"
        },
        {
          "label": {
            "nl": "Nee"
          },
          "target": "niet-van-toepassing"
        }
      ],
      "options": [
        {
          "title": {
            "nl": "Wat betekent \"in de handel brengen\"?"
          },
          "target": "in-de-handel-brengen"
        }
      ]
    },
    {
      "id": "in-de-handel-brengen",
      "title": {
        "nl": "In de handel brengen"
      },
      "description": {
        "nl": "Het voor het eerst beschikbaar stellen van een systeem op de markt van de Unie. Dit is alleen uitleg. Ga terug naar de vorige stap om te antwoorden."
      },
      "metadata": {
        "version": "1.0"
      }
    },
    {
      "id": "niet-van-toepassing",
      "title": {
        "nl": "De verordening is niet van toepassing"
      },
      "description": {
        "nl": "De doorloop eindigt hier."
      },
      "metadata": {
        "version": "1.0"
      },
      "terminal": {
        "label": {
          "nl": "Niet van toepassing"
        }
      }
    },
    {
      "id": "van-toepassing",
      "title": {
        "nl": "De verordening is van toepassing"
      },
      "description": {
        "nl": "De doorloop eindigt hier."
      },
      "metadata": {
        "version": "1.0"
      },
      "terminal": {
        "label": {
          "nl": "Van toepassing"
        }
      }
    }
  ]
}
