{
  "$schema": "/schemas/elsa-tree-7.json",
  "format": "elsa-tree/7",
  "languages": [
    "de"
  ],
  "root": "start",
  "title": {
    "de": "Gilt die KI-Verordnung?"
  },
  "metadata": {
    "version": "1.0"
  },
  "nodes": [
    {
      "id": "start",
      "title": {
        "de": "Fällt Ihr System in den Anwendungsbereich?"
      },
      "description": {
        "de": "Die erste Frage."
      },
      "metadata": {
        "version": "1.0"
      },
      "answers": [
        {
          "label": {
            "de": "Yes"
          },
          "target": "anwendbar"
        },
        {
          "label": {
            "de": "No"
          },
          "target": "nicht-anwendbar"
        }
      ]
    },
    {
      "id": "anwendbar",
      "title": {
        "de": "Die Verordnung ist anwendbar"
      },
      "description": {
        "de": "Der Durchlauf endet hier."
      },
      "metadata": {
        "version": "1.0"
      },
      "terminal": {
        "label": {
          "de": "Applies"
        }
      }
    },
    {
      "id": "nicht-anwendbar",
      "title": {
        "de": "Die Verordnung ist nicht anwendbar"
      },
      "description": {
        "de": "Der Durchlauf endet hier."
      },
      "metadata": {
        "version": "1.0"
      },
      "terminal": {
        "label": {
          "de": "Does not apply"
        }
      }
    }
  ]
}
